A1: sin statistics(QueryItem)
A2: min | B2: max | C2: ratio
A3: 1 | B3: 1 | C3: 0 | D3: =C3*100 -> 0 | E3: 1
A4: 1 | B4: 3 | C4: 0 | D4: =C4*100 -> 0 | E4: 1-3
A5: 3 | B5: 5 | C5: 0.47541 | D5: =C5*100 -> 47.540999999999997 | E5: 3-5
A6: 5 | B6: 7 | C6: 0.83591499999999996 | D6: =C6*100 -> 83.591499999999996 | E6: 5-7
A7: 7 | B7: 9 | C7: 0.877386 | D7: =C7*100 -> 87.738600000000005 | E7: 7-9
A8: dtiu statistics(QueryItem)
A9: min | B9: max | C9: ratio
A10: 1 | B10: 1 | C10: 0 | D10: =C10*100 -> 0 | E10: 1
A11: 1 | B11: 3 | C11: 0 | D11: =C11*100 -> 0 | E11: 1-3
A12: 3 | B12: 5 | C12: 0.222606 | D12: =C12*100 -> 22.2606 | E12: 3-5
A13: 5 | B13: 7 | C13: 0.61126800000000003 | D13: =C13*100 -> 61.126800000000003 | E13: 5-7
A14: 7 | B14: 9 | C14: 0.62922199999999995 | D14: =C14*100 -> 62.922199999999997 | E14: 7-9
A15: rmuo statistics(QueryItem)
A16: min | B16: max | C16: ratio
A17: 1 | B17: 1 | C17: 0 | D17: =C17*100 -> 0 | E17: 1
A18: 1 | B18: 3 | C18: 0 | D18: =C18*100 -> 0 | E18: 1-3
A19: 3 | B19: 5 | C19: 1 | D19: =C19*100 -> 100 | E19: 3-5
A20: 5 | B20: 7 | C20: 1 | D20: =C20*100 -> 100 | E20: 5-7
A21: 7 | B21: 9 | C21: 1 | D21: =C21*100 -> 100 | E21: 7-9
A25: ·Ö¸îÏß£¬ÏÂÃæºÍÉÏÃæÊÇÁ½´ÎÔËÐÐµÄ²»Í¬½á¹û
A27: sin statistics(QueryItem)
A28: min | B28: max | C28: ratio
A29: 1 | B29: 1 | C29: 0 | D29: =C29*100 -> 0 | E29: 1
A30: 1 | B30: 3 | C30: 0.117438 | D30: =C30*100 -> 11.7438 | E30: 1-3
A31: 3 | B31: 5 | C31: 0.71814900000000004 | D31: =C31*100 -> 71.814900000000009 | E31: 3-5
A32: 5 | B32: 7 | C32: 0.65298800000000001 | D32: =C32*100 -> 65.2988 | E32: 5-7
A33: 7 | B33: 9 | C33: 0.88177099999999997 | D33: =C33*100 -> 88.177099999999996 | E33: 7-9
A34: dtiu statistics(QueryItem)
A35: min | B35: max | C35: ratio
A36: 1 | B36: 1 | C36: 0 | D36: =C36*100 -> 0 | E36: 1
A37: 1 | B37: 3 | C37: 4.83986E-2 | D37: =C37*100 -> 4.8398599999999998 | E37: 1-3
A38: 3 | B38: 5 | C38: 0.46574500000000002 | D38: =C38*100 -> 46.5745 | E38: 3-5
A39: 5 | B39: 7 | C39: 0.44642900000000002 | D39: =C39*100 -> 44.642900000000004 | E39: 5-7
A40: 7 | B40: 9 | C40: 0.71753100000000003 | D40: =C40*100 -> 71.753100000000003 | E40: 7-9
A41: rmuo statistics(QueryItem)
A42: min | B42: max | C42: ratio
A43: 1 | B43: 1 | C43: 0 | D43: =C43*100 -> 0 | E43: 1
A44: 1 | B44: 3 | C44: 1 | D44: =C44*100 -> 100 | E44: 1-3
A45: 3 | B45: 5 | C45: 1 | D45: =C45*100 -> 100 | E45: 3-5
A46: 5 | B46: 7 | C46: 1 | D46: =C46*100 -> 100 | E46: 5-7
A47: 7 | B47: 9 | C47: 1 | D47: =C47*100 -> 100 | E47: 7-9