A1: 1 | B1: 1 | C1: 0 | D1: 1 | E1: =PRODUCT(C1,100) -> 0 | K1: 1 | L1: 1 | M1: 0 | N1: =PRODUCT(M1,100) -> 0
A2: 1 | B2: 3 | C2: 0.25151499999999999 | D2: 1-3 | E2: =PRODUCT(C2,100) -> 25.151499999999999 | K2: 1 | L2: 3 | M2: 9.9206299999999997E-2 | N2: =PRODUCT(M2,100) -> 9.9206299999999992
A3: 3 | B3: 5 | C3: 0.83796499999999996 | D3: 3-5 | E3: =PRODUCT(C3,100) -> 83.796499999999995 | K3: 3 | L3: 5 | M3: 0.525953 | N3: =PRODUCT(M3,100) -> 52.595300000000002
A4: 5 | B4: 7 | C4: 0.86714400000000003 | D4: 5-7 | E4: =PRODUCT(C4,100) -> 86.714399999999998 | K4: 5 | L4: 7 | M4: 0.69070200000000004 | N4: =PRODUCT(M4,100) -> 69.0702
A5: 7 | B5: 9 | C5: 0.92457800000000001 | D5: 7-9 | E5: =PRODUCT(C5,100) -> 92.457800000000006 | K5: 7 | L5: 9 | M5: 0.81604399999999999 | N5: =PRODUCT(M5,100) -> 81.604399999999998